{
  "contract": 1,
  "fixture": true,
  "event_id": "evt-0000004",
  "ts": "2026-10-18T14:02:11Z",
  "type": "evidence",
  "role": "manager",
  "payload": {
    "kind": "risks",
    "title": "What to fix first (last 30 days of BGL)",
    "receipt": {
      "receipt_id": "R-0006",
      "tool": "rank_risks",
      "sql": [
        "SELECT … FROM episodes WHERE dataset='bgl' AND start_ts >= TIMESTAMP '2005-12-06' …"
      ],
      "scope": {
        "dataset": "bgl",
        "from": "2005-12-06",
        "to": "2006-01-04",
        "filters": {},
        "unit": "episodes",
        "episode_gap": "10m",
        "group_by": "template",
        "bucket": null
      },
      "total_matches": null,
      "returned": 3,
      "truncated": false,
      "runtime_ms": 42
    },
    "annotations": [],
    "body": {
      "weights": {
        "F": 0.3,
        "S": 0.25,
        "T": 0.2,
        "V": 0.15,
        "L": 0.1
      },
      "items": [
        {
          "rank": 1,
          "title": "data TLB error interrupt (KERNEL)",
          "dataset": "bgl",
          "team": "HPC Kernel & Runtime",
          "score": 86.5,
          "inputs": {
            "F": 0.95,
            "S": 0.8,
            "T": 0.9,
            "V": 1.0,
            "L": 0.6
          },
          "stability_top3": 1.0,
          "action": "Assign HPC Kernel & Runtime to investigate TLB errors on the 19 affected midplanes this week."
        },
        {
          "rank": 2,
          "title": "ciod: failed to read message prefix (APP)",
          "dataset": "bgl",
          "team": "HPC Applications Support",
          "score": 71.0,
          "inputs": {
            "F": 0.85,
            "S": 0.95,
            "T": 0.3,
            "V": 1.0,
            "L": 0.4
          },
          "stability_top3": 0.9,
          "action": "Ask HPC Applications Support to review ciod control-stream failures; monitor weekly."
        },
        {
          "rank": 3,
          "title": "machine check interrupt (KERNEL)",
          "dataset": "bgl",
          "team": "HPC Kernel & Runtime",
          "score": 58.2,
          "inputs": {
            "F": 0.4,
            "S": 0.35,
            "T": 0.7,
            "V": 1.0,
            "L": 0.9
          },
          "stability_top3": 0.6,
          "action": null
        }
      ]
    }
  }
}
